href,payment,description,details
https://www.linkedin.com/jobs/view/data-analyst-at-paramount-pictures-4279650100?position=1&pageNum=0&refId=V500JIdIWVUq1XY%2Bscie6A%3D%3D&trackingId=LrS0azqjDlWLzX0dBilxjA%3D%3D,"$56,000.00/yr - $70,000.00/yr","#WeAreParamount on a mission to unleash the power of content… you in?

We’ve got the brands, we’ve got the stars, and we’ve got the power to achieve our mission to entertain the planet – now all we’re missing is…YOU! Becoming a part of Paramount means joining a team that values authenticity and embraces inclusion for all. We are searching for individuals who not only recognize the power of content but also enjoy a touch of fun and uniqueness. Together, we co-create moments that matter – both for our audiences and our employees. You fuel our culture of purpose, passion, and collaboration. We’re in this together.

Collaborating with the Vice President of Sales Planning & Reporting, the Data Analyst will support Paramount Home Entertainment's analysis and reporting projects. The ideal candidate will have a keen eye for data quality and meticulous attention to detail. They will be technically savvy and be able to navigate complex enterprise systems while working in a fast-paced corporate environment!

Responsibilities include:



Basic qualifications:



Additional qualifications:



Founded in 1912, Paramount Pictures works with talented filmmakers to produce and distribute entertainment around the world. The film studio’s iconic logo has opened some of the most successful and beloved films in cinematic history, including timeless classics such as The Godfather, Chinatown, Forrest Gump and Titanic; and blockbuster franchises such as Star Trek, Transformers, Mission: Impossible and Sonic the Hedgehog. Recent, innovative, break-out films such as The Wolf of Wall Street, Arrival, Rocketman, and A Quiet Place have added to Paramount’s film legacy. With a beautiful 65-acre lot in the heart of Hollywood, a worldwide network of offices and a culture of engagement, Paramount Pictures’ passionate employees ensure the studio continues to deliver creativity and innovation to a dynamic industry. Paramount Pictures controls a collection of some of the most powerful brands in filmed entertainment, including Paramount Pictures, Paramount Animation, and Paramount Players. PPC operations also include Paramount Home Entertainment, Paramount Pictures International, Paramount Licensing Inc., and Paramount Studio Group. Paramount Pictures is a subsidiary of Paramount, which connects with billions of people worldwide through its global brands including MTV, CBS, Paramount Network, Nickelodeon, Comedy Central, BET and streaming service Paramount+.



Hiring Salary Range: $56,000.00 - 70,000.00.

The hiring salary range for this position applies to New York, California, Colorado, Washington state, and most other geographies. Starting pay for the successful applicant depends on a variety of job-related factors, including but not limited to geographic location, market demands, experience, training, and education. The benefits available for this position include medical, dental, vision, 401(k) plan, life insurance coverage, disability benefits, tuition assistance program and PTO or, if applicable, as otherwise dictated by the appropriate Collective Bargaining Agreement.





Paramount is an equal opportunity employer (EOE) including disability/vet.

At Paramount, the spirit of inclusion feeds into everything that we do, on-screen and off. From the programming and movies we create to employee benefits/programs and social impact outreach initiatives, we believe that opportunity, access, resources and rewards should be available to and for the benefit of all. Paramount is proud to be an equal opportunity workplace. We are committed to equal employment opportunity regardless of race, color, ethnicity, ancestry, religion, creed, sex, national origin, sexual orientation, age, citizenship status, marital status, disability, gender identity, gender expression, and Veteran status.

If you are a qualified individual with a disability or a disabled veteran, you may request a reasonable accommodation if you are unable or limited in your ability to use or access https://www.paramount.com/careers as a result of your disability. You can request reasonable accommodations by calling 212.846.5500 or by sending an email to paramountaccommodations@paramount.com. Only messages left for this purpose will be returned.

Show more","Seniority level
Mid-Senior level"
https://www.linkedin.com/jobs/view/data-scientist-finance-at-notion-4290982029?position=2&pageNum=0&refId=V500JIdIWVUq1XY%2Bscie6A%3D%3D&trackingId=teJiQkJ3TSYOAbuUw0U6aQ%3D%3D,"$140,000.00/yr - $175,000.00/yr","About Us

We're on a mission to make it possible for every person, team, and company to be able to tailor their software to solve any problem and take on any challenge. Computers may be our most powerful tools, but most of us can't build or modify the software we use on them every day. At Notion, we want to change this with focus, design, and craft.

We've been working on this together since 2016, and have customers like OpenAI, Toyota, Figma, Ramp, and thousands more on this journey with us. Today, we're growing fast and excited for new teammates to join us who are the best at what they do. We're passionate about building a company as diverse and creative as the millions of people Notion reaches worldwide.

Notion is an in person company, and currently requires its employees to come to the office for two Anchor Days (Mondays & Thursdays) and requests that employees spend the majority of their week in the office (including a third day).



Notion is seeking a Finance Data Scientist to join our growing team. In this role, you'll work at the intersection of Finance, Product, and Go-to-Market, using data to drive Notion's growth and success. The ideal candidate is a strong communicator with a growth mindset who collaborates effectively and focuses on action and impact.

Your work will translate initiatives from both our self-serve and sales-assisted businesses into tangible revenue outcomes. You'll partner with the Strategic Finance team to identify growth opportunities, develop insights that deepen our understanding of the business, and forecast future performance.









We hire talented and passionate people from a variety of backgrounds because we want our global employee base to represent the wide diversity of our customers. If you’re excited about a role but your past experience doesn’t align perfectly with every bullet point listed in the job description, we still encourage you to apply. If you’re a builder at heart, share our company values, and enthusiastic about making software toolmaking ubiquitous, we want to hear from you.

Notion is proud to be an equal opportunity employer. We do not discriminate in hiring or any employment decision based on race, color, religion, national origin, age, sex (including pregnancy, childbirth, or related medical conditions), marital status, ancestry, physical or mental disability, genetic information, veteran status, gender identity or expression, sexual orientation, or other applicable legally protected characteristic. Notion considers qualified applicants with criminal histories, consistent with applicable federal, state and local law. Notion is also committed to providing reasonable accommodations for qualified individuals with disabilities and disabled veterans in our job application procedures. If you need assistance or an accommodation due to a disability, please let your recruiter know.

Notion is committed to providing highly competitive cash compensation, equity, and benefits. The compensation offered for this role will be based on multiple factors such as location, the role’s scope and complexity, and the candidate’s experience and expertise, and may vary from the range provided below. For roles based in San Francisco or New York City, the estimated base salary range for this role is $140,000 - $175,000 per year.

By clicking “Submit Application”, I understand and agree that Notion and its affiliates and subsidiaries will collect and process my information in accordance with Notion’s Global Recruiting Privacy Policy.

Show more","Seniority level
Entry level"
https://www.linkedin.com/jobs/view/data-scientist-marketing-at-notion-4278971840?position=3&pageNum=0&refId=V500JIdIWVUq1XY%2Bscie6A%3D%3D&trackingId=xajKJHuEiy01x%2BzDucHVnA%3D%3D,"$140,000.00/yr - $235,000.00/yr","About Us

Notion helps you build beautiful tools for your life’s work. In today's world of endless apps and tabs, Notion provides one place for teams to get everything done, seamlessly connecting docs, notes, projects, calendar, and email—with AI built in to find answers and automate work. Millions of users, from individuals to large organizations like Toyota, Figma, and OpenAI, love Notion for its flexibility and choose it because it helps them save time and money.

In-person collaboration is essential to Notion's culture. We require all team members to work from our offices on Mondays and Thursdays, our designated Anchor Days. Certain teams or positions may require additional in-office workdays.



As our Data Scientist for marketing, you will be a key business partner to our Marketing team. Your work will be instrumental in shaping our data strategy as we design and implement a Marketing motion. From exploring what successful customer accounts look like to creating sales pipeline forecasts, your insights will directly impact business decisions and strategy. Each day will bring new challenges and opportunities to drive meaningful change with data.













We hire talented and passionate people from a variety of backgrounds because we want our global employee base to represent the wide diversity of our customers. If you’re excited about a role but your past experience doesn’t align perfectly with every bullet point listed in the job description, we still encourage you to apply. If you’re a builder at heart, share our company values, and enthusiastic about making software toolmaking ubiquitous, we want to hear from you.

Notion is proud to be an equal opportunity employer. We do not discriminate in hiring or any employment decision based on race, color, religion, national origin, age, sex (including pregnancy, childbirth, or related medical conditions), marital status, ancestry, physical or mental disability, genetic information, veteran status, gender identity or expression, sexual orientation, or other applicable legally protected characteristic. Notion considers qualified applicants with criminal histories, consistent with applicable federal, state and local law. Notion is also committed to providing reasonable accommodations for qualified individuals with disabilities and disabled veterans in our job application procedures. If you need assistance or an accommodation due to a disability, please let your recruiter know.

Notion is committed to providing highly competitive cash compensation, equity, and benefits. The compensation offered for this role will be based on multiple factors such as location, the role’s scope and complexity, and the candidate’s experience and expertise, and may vary from the range provided below. For roles based in San Francisco, the estimated base salary range for this role is $140,000 - $235,000 per year.

By clicking “Submit Application”, I understand and agree that Notion and its affiliates and subsidiaries will collect and process my information in accordance with Notion’s Global Recruiting Privacy Policy.

Show more","Seniority level
Not Applicable"
https://www.linkedin.com/jobs/view/data-scientist-at-zillow-4278390413?position=4&pageNum=0&refId=V500JIdIWVUq1XY%2Bscie6A%3D%3D&trackingId=m5K6XGPKnfrXhPhIglSpug%3D%3D,"$123,200.00/yr - $196,800.00/yr","About The Team

Zillow Group’s Agent Software & Advertising (ASA) organization represents the next step forward in the company's dedication to integrate an improved, more efficient showing process to benefit customers and partners, their clients and the real estate industry as a whole.

ASA has built and acquired a portfolio of market-leading products for agent productivity, listing media, showing coordination, transaction management and analytics solutions. Our wide array of products and services are built on technological innovations crafted to bring efficiencies to all users.



The Business Data Science team within Zillow is hiring a Data Scientist to lead analytics to uncover insights to drive both better business decisions and customer experiences across our product portfolio.





This role has been categorized as a Remote position. “Remote” employees do not have a permanent corporate office workplace and, instead, work from a physical location of their choice, which must be identified to the Company. U.S. employees may live in any of the 50 United States, with limited exceptions.

In California, Colorado, Connecticut, Hawaii, Illinois, Maryland, Massachusetts, Minnesota, Nevada, New Jersey, New York, Rhode Island, Vermont, Washington state, and Washington DC the standard base pay range for this role is $123,200.00 - $196,800.00 Annually. This base pay range is specific to California, Colorado, Connecticut, Hawaii, Illinois, Maryland, Massachusetts, Minnesota, Nevada, New Jersey, New York, Rhode Island, Vermont, Washington state, and Washington DC and may not be applicable to other locations.

In addition to a competitive base salary this position is also eligible for equity awards based on factors such as experience, performance and location. Actual amounts will vary depending on experience, performance and location.

Who you are

You are ready to bring your data and analytics expertise to transform what it means for the real estate industry to unlock the ability for consumers to dream, search, and find a home. You have an appreciation of the unique challenges posed by business to business product development and go-to-market.





Get to know us

Zillow is reimagining real estate to make home a reality for more and more people.

As the most-visited real estate website in the United States, Zillow® and its affiliates help movers find and win their home through digital solutions, first class partners, and easier buying, selling, financing and renting experiences. Millions of people visit Zillow Group sites every month to start their home search, and now they can rely on Zillow to help make it easier to move. The work we do helps people get home and no matter what job you're in, you will play a critical role in making home a reality for more and more people.

Our efforts to streamline the real estate transaction are supported by a deep-rooted culture of innovation, our passion to redefine the employee experience, a fundamental commitment to Equity and Belonging, and world-class benefits. These benefits include comprehensive medical, dental, vision, life, and disability coverages as well as parental leave, family benefits, retirement contributions, and paid time off. We’re also setting the standard for work experiences of the future, where our employees are supported in doing their best work and living a flexible, well-balanced life. But don’t just take our word for it. Read recent reviews on Glassdoor and recent recognition from multiple organizations, including: the 100 Best Companies to Work For, Glassdoor Employees’ Choice Award, Bloomberg Gender-Equality Index, Human Rights Campaign (HRC) Corporate Equity Index, and TIME 100 Most Influential Companies list.





Show more","Seniority level
Mid-Senior level"
https://www.linkedin.com/jobs/view/bi-developer-at-linkedin-4290222262?position=5&pageNum=0&refId=V500JIdIWVUq1XY%2Bscie6A%3D%3D&trackingId=VUAp8LNfatP502sjvgELkg%3D%3D,"$112,000.00/yr - $185,000.00/yr","Company Description

LinkedIn is the world’s largest professional network, built to create economic opportunity for every member of the global workforce. Our products help people make powerful connections, discover exciting opportunities, build necessary skills, and gain valuable insights every day. We’re also committed to providing transformational opportunities for our own employees by investing in their growth. We aspire to create a culture that’s built on trust, care, inclusion, and fun – where everyone can succeed.

Join us to transform the way the world works.



This role will be based in Sunnyvale, San Francisco, Chicago or New York depending upon which location the applicant chosen for the role is currently residing.

At LinkedIn, our approach to flexible work is centered on trust and optimized for culture, connection, clarity, and the evolving needs of our business. The work location of this role is hybrid, meaning it will be performed both from home and from a LinkedIn office on select days, as determined by the business needs of the team.

The ideal candidate will require advanced visualization skills (PowerBI / Tableau) and SQL skills to create impactful data visualizations and insights. This will span all phases of the data asset development lifecycle (e.g., requirements elicitation through development and eventual sunset). The candidate should also have strong analytical skills and be adept at deriving, distilling and articulating actionable business insights from large amounts of data. Using strong communication skills, the role will effectively collaborate with a variety of people and job functions, accomplishing tasks of high complexity and scope, and can perform professionally in a challenging and extremely fast-paced environment.

What You’ll Do:






Basic Qualifications:




Preferred Qualifications:




Suggested Skills:




LinkedIn is committed to fair and equitable compensation practices.

The pay range for this role is $112,000 to $185,000. Actual compensation packages are based on a wide array of factors unique to each candidate, including but not limited to skill set, years & depth of experience, certifications and specific office location. This may differ in other locations due to cost of labor considerations.

The total compensation package for this position may also include annual performance bonus, stock, benefits and/or other applicable incentive compensation plans. For additional information, visit: https://careers.linkedin.com/benefits.





We seek candidates with a wide range of perspectives and backgrounds and we are proud to be an equal opportunity employer. LinkedIn considers qualified applicants without regard to race, color, religion, creed, gender, national origin, age, disability, veteran status, marital status, pregnancy, sex, gender expression or identity, sexual orientation, citizenship, or any other legally protected class.

LinkedIn is committed to offering an inclusive and accessible experience for all job seekers, including individuals with disabilities. Our goal is to foster an inclusive and accessible workplace where everyone has the opportunity to be successful.

If you need a reasonable accommodation to search for a job opening, apply for a position, or participate in the interview process, connect with us at accommodations@linkedin.com and describe the specific accommodation requested for a disability-related limitation.

Reasonable accommodations are modifications or adjustments to the application or hiring process that would enable you to fully participate in that process. Examples of reasonable accommodations include but are not limited to:




A request for an accommodation will be responded to within three business days. However, non-disability related requests, such as following up on an application, will not receive a response.

LinkedIn will not discharge or in any other manner discriminate against employees or applicants because they have inquired about, discussed, or disclosed their own pay or the pay of another employee or applicant. However, employees who have access to the compensation information of other employees or applicants as a part of their essential job functions cannot disclose the pay of other employees or applicants to individuals who do not otherwise have access to compensation information, unless the disclosure is (a) in response to a formal complaint or charge, (b) in furtherance of an investigation, proceeding, hearing, or action, including an investigation conducted by LinkedIn, or (c) consistent with LinkedIn's legal duty to furnish information.



Pursuant to the San Francisco Fair Chance Ordinance, LinkedIn will consider for employment qualified applicants with arrest and conviction records.



As a federal contractor, LinkedIn follows the Pay Transparency and non-discrimination provisions described at this link: https://lnkd.in/paytransparency.



Please follow this link to access the document that provides transparency around the way in which LinkedIn handles personal data of employees and job applicants: https://legal.linkedin.com/candidate-portal.

Show more","Seniority level
Mid-Senior level"
