href,payment,description,details
https://www.linkedin.com/jobs/view/data-analyst-i-at-lensa-4289736989?position=16&pageNum=0&refId=V500JIdIWVUq1XY%2Bscie6A%3D%3D&trackingId=fxqtAa%2BRXDVN7Zb0%2BewNoQ%3D%3D,"$63,000.00/yr - $81,500.00/yr","Lensa is a career site that helps job seekers find great jobs in the US. We are not a staffing firm or agency. Lensa does not hire directly for these jobs, but promotes jobs on LinkedIn on behalf of its direct clients, recruitment ad agencies, and marketing partners. Lensa partners with DirectEmployers to promote this job for The Joint Commission. Clicking ""Apply Now"" or ""Read more"" on Lensa redirects you to the job board/employer site. Any information collected there is subject to their terms and privacy notice.



The National Quality Forum (NQF), an affiliate of The Joint Commission (TJC), houses a Data and Analytics team that supports the analytical needs of NQF and TJC in advancing their shared mission of improving health care for all people. We support exciting initiatives that advance healthcare patient quality and safety through activities at both organizations. Our group works enterprise wide to support the development and application of data infrastructure and methods for quality measure development and implementation, quality improvement, program evaluation, and data visualization. Our current work includes developing and supporting approaches to advance the use of next generation measures, including outcome and patient-reported outcome measures calculated using clinical, claims, survey and other data, at scale in Joint Commission and other public and private programs to achieve high quality care for all people.

We are seeking a Data Analyst I who is intellectually curious, collaborative, and passionate about leveraging data to drive innovation in healthcare quality. This is an excellent opportunity for early-career professionals or recent graduates to gain hands-on experience in data analysis, visualization, and quality measurement in a mission-driven environment.

As part of a collaborative and innovative team, the Data Analyst I will contribute to data preparation, analysis, and reporting efforts that inform healthcare quality initiatives. To thrive in the role, the candidates need to be detail-oriented in your conception and coding of data models, processes, and analyses, as well as have a strong foundation in statistical methodology. This role contributes to helping researchers, product teams, and policymakers determine how quality measure data impacts health outcomes, disparities, patient safety, and affordability, hence we value both teamwork and interest in the subject matter. As part of a cross-functional, innovative team, the Data Analyst I will work to score, benchmark, and visualize quality measures, expanding the development and use of next-generation quality measures-high priority, low burden measures that improve equity, quality, and affordability-in Joint Commission programs and other scaled public and private payment and accountability programs. The Data Analyst I will report to the Program Director of Data Science, who will provide mentorship, task guidance, and constructive feedback. This position offers a strong foundation for career growth in more advanced data roles in data science, statistics, and other data disciplines.

The position requires in-person attendance two days per week, with flexibility for occasional exceptions. While the preferred location is the Washington, D.C. office, we are open to candidates based in Oakbrook Terrace, IL, depending on qualifications and fit.







Education: Bachelor's degree required with training and experience data manipulation and analysis. The most relevant degrees include Statistics, Biostatistics, Data Science, Computer Science, Epidemiology, Mathematics, Health Informatics.









We offer a comprehensive benefit package. For a complete overview of our benefits package, please visit ourJoint Commission Career Page (https://www.jointcommission.org/careers/#434f5b531a144a35906939ce76ce893c_cf7b457e1e9842329663d569f5c839cb)

This job description is intended to describe the general nature and level of work performed by an employee assigned to this position. The description is not an exhaustive list of all duties, responsibilities, knowledge, skills, and abilities, and working conditions associated with this position. All requirements are subject to possible modification and reasonably accommodate individuals with disabilities.



USD $63,000.00/year



USD $81,500.00/year









If you have questions about this posting, please contact support@lensa.com
Show more","Seniority level
Entry level"
https://www.linkedin.com/jobs/view/data-scientist-marketing-at-wealthfront-4274395060?position=17&pageNum=0&refId=V500JIdIWVUq1XY%2Bscie6A%3D%3D&trackingId=FtLmpzk0zJYw2nAyUxLhHA%3D%3D,"$164,000.00/yr - $211,000.00/yr","The Wealthfront Data Science team utilizes our rich financial and behavioral data to influence Marketing, Product and information security decisions. The team draws from backgrounds in Computer Science, Natural Sciences, Statistics, Operations Research, Economics and Finance.






















Show more","Seniority level
Mid-Senior level"
https://www.linkedin.com/jobs/view/data-scientist-at-drt-strategies-4290941993?position=18&pageNum=0&refId=V500JIdIWVUq1XY%2Bscie6A%3D%3D&trackingId=qs7Ns0v4F8Vt2o7zzhYzsg%3D%3D,"$60,000.00/yr - $80,000.00/yr","Overview

DRT Strategies delivers expert management consulting and information technology (IT) solutions to large federal agencies, the U.S. Navy, state and local government and commercial clients in health care, technology, and financial services industries.

The three letters of our name, DRT, stand for Driving Resolution Together, which is the core philosophy on which the company was founded. That is, we collaborate with our clients to solve their most pressing challenges - together.

We are problem solvers dedicated to your success, combining Fortune 500 experience with small business responsiveness. We have established a reputation with our clients as a forward-thinking consulting firm with demonstrated success in implementing solutions that lead to meaningful results. Our world-class consultants unite people to work collaboratively to achieve project goals and make vision a reality.



DRT provides GIS solutions to address diverse, complex, and emerging problems within the public health domains of environmental health, infectious disease, chronic disease, and emergency preparedness/response. Our support includes the design, development, and enhancements of internal and external applications, websites, and database solutions with geospatial components. Our team develops innovative data capture and analysis techniques in the field to enhance emergency response efforts all around the world.



The Data Scientist role will provide data quality analysis for the United States Cancer Statistics (USCS) and National Program of Cancer Registry (NPCR) databases to ensure integrity and find inadequacies and inconsistencies of variables within databases.























DRT offers full-time benefit eligible employees a competitive total compensation package. Employees may begin participating in employer sponsored group medical, dental, and vision coverage on their first day of employment. DRT also has a 401(K)-retirement plan, company paid short-term and long-term disability, life insurance, AD&D coverage, and an employee assistant program (EAP). Employees may also elect critical illness coverage, accident coverage, flexible spending accounts, and health saving account options. The DRT leave programs include Paid Time Off (PTO) each calendar year, paid holidays annually, paid parental leave, and unpaid job protected leave administered in accordance with the Family Medical Leave Act (FMLA).



DRT Strategies, Inc. (DRT) celebrates diversity and is proud to provide Equal Employment Opportunities (EEO) to all employees and qualified applicants for employment without regard to race, color, creed, religion, national origin, gender, sexual orientation, age, gender identity, genetic information, disability, protected veteran status, or any other protected characteristic under federal, state, or local laws.

Reasonable accommodation for applicants and employees with disabilities will be provided. If a reasonable accommodation is needed to participate in the job application or interview process, to perform essential job functions, and/or to receive other benefits and privileges of employment, please contact Human Resources by emailing [email protected], or by dialing 571-482-2517.

DRT Strategies, Inc. (DRT) follows the guidelines outlined by the Equal Employment Opportunity Commission (EEOC) to provide all employees and qualified applicants employment without regard to race, color, religion, sex (including pregnancy, childbirth, or related conditions, transgender status, and sexual orientation), national origin, age, genetic information, disability, protected veteran status, or any other protected characteristic under federal, state, or local law.

Reasonable accommodations for applicants and employees with disabilities will be provided. If a reasonable accommodation is needed to participate in the job application or interview process, to perform essential job functions, and/or to receive other benefits and privileges of employment, please contact Human Resources by emailing HR@drtstrategies.com, or by dialing 571-482-2517.

For additional information, please review the Know Your Rights: Workplace Discrimination is Illegal, E-Verify (English), E-Verify (Spanish). Right to Work (English), Right to Work (Spanish).

Please be aware of recruitment fraud where malicious individuals might pose as DRT Strategies. Only job postings and emails from drtstrategies.com are authentic and legitimate communications regarding DRT Strategies employment opportunities. Please contact Human Resources at hr@drtstrategies.com if you believe you have received a fraudulent email.
Show more","Seniority level
Mid-Senior level"
https://www.linkedin.com/jobs/view/data-scientist-at-rev-io-4289132389?position=19&pageNum=0&refId=V500JIdIWVUq1XY%2Bscie6A%3D%3D&trackingId=EeUzlpnwCx5NgZqJKfTW9w%3D%3D,,"About Rev.io

Rev.io provides configurable software for billing, customer management, business management, payments, analytics, provisioning, and automation to service providers in telecommunications, Wireless & IoT, managed IT services, A/V, security integration, and other related industries. Our modern, cloud-based software delivers the industry’s most complete quote-to-cash experience, enabling our clients to grow their revenue efficiently.

Rev.io is an Atlanta-based company with offices in Atlanta and West Virginia. We have more than 21 years in business serving our clients. While we are very experienced in what we do, we are still growing rapidly, and we are looking for exceptional people who are excited to join us on a career-defining journey.

In all of our daily work, each of us is guided by our mission, vision and “ACT TOP” values.

To help clients grow revenue efficiently.

To be the best billing & back-office software company in the world by providing innovative solutions and extraordinary service to our clients and end users.







: We are seeking a highly skilled Data scientist to join our team and drive cutting-edge innovations in machine learning, deep learning, and natural language processing (NLP) applications. This role will focus on building and optimizing machine learning models and AI systems that support key business functions. You will work closely with cross-functional teams including Finance, Marketing, Client Success, and Product teams to transform business challenges into actionable insights.

The Data scientist will report directly to the Engineering Manager, and will work closely with the Engineering team, and other technology leaders to ensure that existing and new data solutions follow best practices and are highly performant.



The Data scientist will play a pivotal role in developing and applying machine learning models, NLP techniques, and deep learning methods to solve complex business problems. The role will focus on innovation, scalability, and the integration of AI-driven solutions into business processes. You will be responsible for designing, implementing, and optimizing solutions that deliver measurable business impact through advanced analytics, experimentation, and predictive modeling.













At Rev.io no employee or applicant will be treated less favorably on the grounds of their sex, marital status, race, color, nationality or ethnic or national origin, disability, gender, sexual orientation, gender identity, age, pregnancy or maternity, marital or civil partner status, or religion or belief. By clicking submit below, you consent to allow Rev.io to store and process the personal information submitted above.

Powered by JazzHR

lGS2bzHhkw

Show more","Seniority level
Mid-Senior level"
https://www.linkedin.com/jobs/view/data-scientist-graduate-tiktok-product-data-science-2026-start-bs-ms-at-tiktok-4279283616?position=20&pageNum=0&refId=V500JIdIWVUq1XY%2Bscie6A%3D%3D&trackingId=5RlLI2423SFrszIkVuWS%2BQ%3D%3D,"$114,000.00/yr - $177,777.00/yr","Responsibilities

Team Introduction

TikTok-Data Science team is responsible for all data science and analytics related work, cooperating with all key value chains in TikTok, including User Growth, PGC, Content Ecosystem, Social, Creation, Product Infrastructure, Research and Science etc. The goal of the team is to generate actionable insights from data and help the stakeholders to make the right decisions. Our main tasks include metrics defining, root cause analysis, experimentation methodology, feature/strategy evaluation and exploratory analysis to find more opportunities.

We are looking for talented individuals to join our team in 2026. As a graduate, you will get opportunities to pursue bold ideas, tackle complex challenges, and unlock limitless growth. Launch your career where inspiration is infinite at TikTok.

Successful candidates must be able to commit to an onboarding date by end of year 2026. Please state your availability and graduation date clearly in your resume.



Candidates can apply to a maximum of two positions and will be considered for jobs in the order you apply. The application limit is applicable to TikTok and its affiliates' jobs globally. Applications will be reviewed on a rolling basis. We encourage you to apply as early as possible.

Successful candidates must be able to commit to an onboarding date by end of year 2026.







Minimum Qualifications



Preferred Qualifications



By submitting an application for this role, you accept and agree to our global applicant privacy policy, which may be accessed here: https://careers.tiktok.com/legal/privacy

Job Information



The base salary range for this position in the selected city is $114000 - $177777 annually.

Compensation may vary outside of this range depending on a number of factors, including a candidate’s qualifications, skills, competencies and experience, and location. Base pay is one part of the Total Package that is provided to compensate and recognize employees for their work, and this role may be eligible for additional discretionary bonuses/incentives, and restricted stock units.

Benefits may vary depending on the nature of employment and the country work location. Employees have day one access to medical, dental, and vision insurance, a 401(k) savings plan with company match, paid parental leave, short-term and long-term disability coverage, life insurance, wellbeing benefits, among others. Employees also receive 10 paid holidays per year, 10 paid sick days per year and 17 days of Paid Personal Time (prorated upon hire with increasing accruals by tenure).

The Company reserves the right to modify or change these benefits programs at any time, with or without notice.



Qualified applicants with arrest or conviction records will be considered for employment in accordance with all federal, state, and local laws including the Los Angeles County Fair Chance Ordinance for Employers and the California Fair Chance Act. Our company believes that criminal history may have a direct, adverse and negative relationship on the following job duties, potentially resulting in the withdrawal of the conditional offer of employment:





TikTok is the leading destination for short-form mobile video. At TikTok, our mission is to inspire creativity and bring joy. TikTok's global headquarters are in Los Angeles and Singapore, and we also have offices in New York City, London, Dublin, Paris, Berlin, Dubai, Jakarta, Seoul, and Tokyo.

Why Join Us

Inspiring creativity is at the core of TikTok's mission. Our innovative product is built to help people authentically express themselves, discover and connect – and our global, diverse teams make that possible. Together, we create value for our communities, inspire creativity and bring joy - a mission we work towards every day.

We strive to do great things with great people. We lead with curiosity, humility, and a desire to make impact in a rapidly growing tech company. Every challenge is an opportunity to learn and innovate as one team. We're resilient and embrace challenges as they come. By constantly iterating and fostering an ""Always Day 1"" mindset, we achieve meaningful breakthroughs for ourselves, our company, and our users. When we create and grow together, the possibilities are limitless. Join us.

Diversity & Inclusion

TikTok is committed to creating an inclusive space where employees are valued for their skills, experiences, and unique perspectives. Our platform connects people from across the globe and so does our workplace. At TikTok, our mission is to inspire creativity and bring joy. To achieve that goal, we are committed to celebrating our diverse voices and to creating an environment that reflects the many communities we reach. We are passionate about this and hope you are too.

TikTok Accommodation

TikTok is committed to providing reasonable accommodations in our recruitment processes for candidates with disabilities, pregnancy, sincerely held religious beliefs or other reasons protected by applicable laws. If you need assistance or a reasonable accommodation, please reach out to us at https://tinyurl.com/RA-request
Show more","Seniority level
Internship"
https://www.linkedin.com/jobs/view/quantitative-analyst-at-los-angeles-dodgers-4289993918?position=21&pageNum=0&refId=V500JIdIWVUq1XY%2Bscie6A%3D%3D&trackingId=k6hhc4U6pbcYYGtcReBPkw%3D%3D,"$90,000.00/yr - $100,000.00/yr","The Los Angeles Dodgers currently have a job opportunity for a Quantitative Analyst. Following you will find a brief description of the job and application process. For additional information, please contact TalentRelations@ladodgers.com.
Title: Quantitative Analyst








Show more","Seniority level
Mid-Senior level"
https://www.linkedin.com/jobs/view/data-scientist-statistician-at-brycetech-4290961751?position=22&pageNum=0&refId=V500JIdIWVUq1XY%2Bscie6A%3D%3D&trackingId=Q%2BeNWJg2sN0cdFRt2CD9nQ%3D%3D,,"Company Description

BryceTech is a trusted leader in complex technology domains, delivering data-driven solutions in aerospace, biosecurity, and defense. We specialize in systems engineering, advanced analytics, and R&D program and strategic advisory support. Our clients – including NASA, DoD, HHS, DHS, and other civil and national security agencies – rely on us to drive mission success and accelerate innovation.

BryceTech has been recognized in the Fast 50 ranking of top high-growth small businesses for four consecutive years and received a GovCon Contractor of the Year Award in 2023, underscoring our strong growth, competitive positioning, and excellence in federal contracting. With a proven track record of winning sought after contracts, scaling high-performance teams, and executing on critical government missions, BryceTech presents a compelling opportunity for strategic partnerships in the GovCon space.





The is seeking a to support its mission of strengthening U.S. economic competitiveness through robust, data-driven supply chain research and analytics. In this role, you will play a key part in transforming raw data into actionable insights that inform federal policy and strategic decision-making in support of U.S. industry.





Qualifications









Additional Information

Employment is contingent upon contract award.

BryceTech offers a full range of benefits, including competitive salary, a comprehensive health plan including dental and vision coverage, company-paid life & disability insurance policies, 401(k) plan with company match, and an educational reimbursement program.

All your information will be kept confidential according to EEO guidelines.
Show more","Seniority level
Entry level"
https://www.linkedin.com/jobs/view/data-scientist-iii-remote-work-option-at-nike-4279141318?position=23&pageNum=0&refId=V500JIdIWVUq1XY%2Bscie6A%3D%3D&trackingId=0iOMpZYqK2RVZCHcYRyEgQ%3D%3D,"$107,700.00/yr - $212,600.00/yr","Open to remote work except in South Dakota, Vermont and West Virginia.

The annual base salary for this position ranges from $107,700.00 in our lowest geographic market to $212,600.00 in our highest geographic market. Actual salary will vary based on a candidate's location, qualifications, skills and experience.





We’re looking for a Data Scientist III to join our Reporting + Intelligence team in the Consumer Product & Innovation organization. You will work with diverse cross-functional team members leveraging data-driven insights and AI to inform and optimize all stages of Nike's merchandising and apparel & footwear product creation lifecycle.



You will partner with cross-functional teams to develop data-driven insights, predictive models, and optimization solutions for Nike's apparel and footwear product merchandising, design and development functions. Leveraging your deep expertise in statistical analysis, machine learning, and applied data science you will help solve complex problems across the apparel and footwear product lifecycle. You will be responsible for developing scalable models, conducting exploratory data analysis, and generating actionable insights that drive data-driven decisions for our merchants and creators.







You will spend much of your time with peer data scientists, machine learning engineers, and merchandising, apparel and footwear creation Product Managers in CP&I delivery teams.





We offer a number of accommodations to complete our interview process including screen readers, sign language interpreters, accessible and single location for in-person interviews, closed captioning, and other reasonable modifications as needed. If you discover, as you navigate our application process, that you need assistance or an accommodation due to a disability, please complete the Candidate Accommodation Request Form.
Show more","Seniority level
Mid-Senior level"
https://www.linkedin.com/jobs/view/data-scientist-at-visa-4289520556?position=24&pageNum=0&refId=V500JIdIWVUq1XY%2Bscie6A%3D%3D&trackingId=e%2BSx%2F929fg0Ms3uDpKPFgA%3D%3D,"$111,000.00/yr - $155,350.00/yr","Visa is a world leader in payments and technology, with over 259 billion payments transactions flowing safely between consumers, merchants, financial institutions, and government entities in more than 200 countries and territories each year. Our mission is to connect the world through the most innovative, convenient, reliable, and secure payments network, enabling individuals, businesses, and economies to thrive while driven by a common purpose – to uplift everyone, everywhere by being the best way to pay and be paid.































































Show more","Seniority level
Mid-Senior level"
